
> @vtx-ui/react@0.0.1-beta.16 test
> jest

FAIL tests/components/Text.test.tsx
  ● Text › applies color styles

    expect(received).toBe(expected) // Object.is equality

    Expected: "rgb(255, 0, 0)"
    Received: ""

      47 |     render(<Text color="#ff0000">Red text</Text>);
      48 |     const element = screen.getByText('Red text');
    > 49 |     expect(element.style.color).toBe('rgb(255, 0, 0)');
         |                                 ^
      50 |   });
      51 |
      52 |   it('applies weight classes', () => {

      at Object.<anonymous> (tests/components/Text.test.tsx:49:33)

FAIL tests/components/FileUpload.test.tsx
  ● Console

    console.error
      An update to FileUpload inside a test was not wrapped in act(...).

      When testing, code that causes React state updates should be wrapped into act(...):

      act(() => {
        /* fire events that update state */
      });
      /* assert on the output */

      This ensures that you're testing the behavior the user would see in the browser. Learn more at https://react.dev/link/wrap-tests-with-act

      197 |         );
      198 |       } else {
    > 199 |         setFiles(prev =>
          |         ^
      200 |           prev.map(f =>
      201 |             f.id === fileId ? { ...f, progress } : f
      202 |           )

      at node_modules/react-dom/cjs/react-dom-client.development.js:18758:19
      at runWithFiberInDEV (node_modules/react-dom/cjs/react-dom-client.development.js:874:13)
      at warnIfUpdatesNotWrappedWithActDEV (node_modules/react-dom/cjs/react-dom-client.development.js:18757:9)
      at scheduleUpdateOnFiber (node_modules/react-dom/cjs/react-dom-client.development.js:16409:11)
      at dispatchSetStateInternal (node_modules/react-dom/cjs/react-dom-client.development.js:9170:13)
      at dispatchSetState (node_modules/react-dom/cjs/react-dom-client.development.js:9127:7)
      at src/components/FileUpload/FileUpload.tsx:199:9
      at Object.<anonymous> (tests/components/FileUpload.test.tsx:15:10)

    console.error
      An update to FileUpload inside a test was not wrapped in act(...).

      When testing, code that causes React state updates should be wrapped into act(...):

      act(() => {
        /* fire events that update state */
      });
      /* assert on the output */

      This ensures that you're testing the behavior the user would see in the browser. Learn more at https://react.dev/link/wrap-tests-with-act

      197 |         );
      198 |       } else {
    > 199 |         setFiles(prev =>
          |         ^
      200 |           prev.map(f =>
      201 |             f.id === fileId ? { ...f, progress } : f
      202 |           )

      at node_modules/react-dom/cjs/react-dom-client.development.js:18758:19
      at runWithFiberInDEV (node_modules/react-dom/cjs/react-dom-client.development.js:874:13)
      at warnIfUpdatesNotWrappedWithActDEV (node_modules/react-dom/cjs/react-dom-client.development.js:18757:9)
      at scheduleUpdateOnFiber (node_modules/react-dom/cjs/react-dom-client.development.js:16409:11)
      at dispatchSetStateInternal (node_modules/react-dom/cjs/react-dom-client.development.js:9170:13)
      at dispatchSetState (node_modules/react-dom/cjs/react-dom-client.development.js:9127:7)
      at src/components/FileUpload/FileUpload.tsx:199:9
      at Object.<anonymous> (tests/components/FileUpload.test.tsx:15:10)

    console.error
      An update to FileUpload inside a test was not wrapped in act(...).

      When testing, code that causes React state updates should be wrapped into act(...):

      act(() => {
        /* fire events that update state */
      });
      /* assert on the output */

      This ensures that you're testing the behavior the user would see in the browser. Learn more at https://react.dev/link/wrap-tests-with-act

      197 |         );
      198 |       } else {
    > 199 |         setFiles(prev =>
          |         ^
      200 |           prev.map(f =>
      201 |             f.id === fileId ? { ...f, progress } : f
      202 |           )

      at node_modules/react-dom/cjs/react-dom-client.development.js:18758:19
      at runWithFiberInDEV (node_modules/react-dom/cjs/react-dom-client.development.js:874:13)
      at warnIfUpdatesNotWrappedWithActDEV (node_modules/react-dom/cjs/react-dom-client.development.js:18757:9)
      at scheduleUpdateOnFiber (node_modules/react-dom/cjs/react-dom-client.development.js:16409:11)
      at dispatchSetStateInternal (node_modules/react-dom/cjs/react-dom-client.development.js:9170:13)
      at dispatchSetState (node_modules/react-dom/cjs/react-dom-client.development.js:9127:7)
      at src/components/FileUpload/FileUpload.tsx:199:9
      at Object.<anonymous> (tests/components/FileUpload.test.tsx:15:10)

    console.error
      An update to FileUpload inside a test was not wrapped in act(...).

      When testing, code that causes React state updates should be wrapped into act(...):

      act(() => {
        /* fire events that update state */
      });
      /* assert on the output */

      This ensures that you're testing the behavior the user would see in the browser. Learn more at https://react.dev/link/wrap-tests-with-act

      197 |         );
      198 |       } else {
    > 199 |         setFiles(prev =>
          |         ^
      200 |           prev.map(f =>
      201 |             f.id === fileId ? { ...f, progress } : f
      202 |           )

      at node_modules/react-dom/cjs/react-dom-client.development.js:18758:19
      at runWithFiberInDEV (node_modules/react-dom/cjs/react-dom-client.development.js:874:13)
      at warnIfUpdatesNotWrappedWithActDEV (node_modules/react-dom/cjs/react-dom-client.development.js:18757:9)
      at scheduleUpdateOnFiber (node_modules/react-dom/cjs/react-dom-client.development.js:16409:11)
      at dispatchSetStateInternal (node_modules/react-dom/cjs/react-dom-client.development.js:9170:13)
      at dispatchSetState (node_modules/react-dom/cjs/react-dom-client.development.js:9127:7)
      at src/components/FileUpload/FileUpload.tsx:199:9
      at Object.<anonymous> (tests/components/FileUpload.test.tsx:15:10)

    console.error
      An update to FileUpload inside a test was not wrapped in act(...).

      When testing, code that causes React state updates should be wrapped into act(...):

      act(() => {
        /* fire events that update state */
      });
      /* assert on the output */

      This ensures that you're testing the behavior the user would see in the browser. Learn more at https://react.dev/link/wrap-tests-with-act

      197 |         );
      198 |       } else {
    > 199 |         setFiles(prev =>
          |         ^
      200 |           prev.map(f =>
      201 |             f.id === fileId ? { ...f, progress } : f
      202 |           )

      at node_modules/react-dom/cjs/react-dom-client.development.js:18758:19
      at runWithFiberInDEV (node_modules/react-dom/cjs/react-dom-client.development.js:874:13)
      at warnIfUpdatesNotWrappedWithActDEV (node_modules/react-dom/cjs/react-dom-client.development.js:18757:9)
      at scheduleUpdateOnFiber (node_modules/react-dom/cjs/react-dom-client.development.js:16409:11)
      at dispatchSetStateInternal (node_modules/react-dom/cjs/react-dom-client.development.js:9170:13)
      at dispatchSetState (node_modules/react-dom/cjs/react-dom-client.development.js:9127:7)
      at src/components/FileUpload/FileUpload.tsx:199:9
      at Object.<anonymous> (tests/components/FileUpload.test.tsx:15:10)

    console.error
      An update to FileUpload inside a test was not wrapped in act(...).

      When testing, code that causes React state updates should be wrapped into act(...):

      act(() => {
        /* fire events that update state */
      });
      /* assert on the output */

      This ensures that you're testing the behavior the user would see in the browser. Learn more at https://react.dev/link/wrap-tests-with-act

      197 |         );
      198 |       } else {
    > 199 |         setFiles(prev =>
          |         ^
      200 |           prev.map(f =>
      201 |             f.id === fileId ? { ...f, progress } : f
      202 |           )

      at node_modules/react-dom/cjs/react-dom-client.development.js:18758:19
      at runWithFiberInDEV (node_modules/react-dom/cjs/react-dom-client.development.js:874:13)
      at warnIfUpdatesNotWrappedWithActDEV (node_modules/react-dom/cjs/react-dom-client.development.js:18757:9)
      at scheduleUpdateOnFiber (node_modules/react-dom/cjs/react-dom-client.development.js:16409:11)
      at dispatchSetStateInternal (node_modules/react-dom/cjs/react-dom-client.development.js:9170:13)
      at dispatchSetState (node_modules/react-dom/cjs/react-dom-client.development.js:9127:7)
      at src/components/FileUpload/FileUpload.tsx:199:9
      at Object.<anonymous> (tests/components/FileUpload.test.tsx:15:10)

    console.error
      An update to FileUpload inside a test was not wrapped in act(...).

      When testing, code that causes React state updates should be wrapped into act(...):

      act(() => {
        /* fire events that update state */
      });
      /* assert on the output */

      This ensures that you're testing the behavior the user would see in the browser. Learn more at https://react.dev/link/wrap-tests-with-act

      197 |         );
      198 |       } else {
    > 199 |         setFiles(prev =>
          |         ^
      200 |           prev.map(f =>
      201 |             f.id === fileId ? { ...f, progress } : f
      202 |           )

      at node_modules/react-dom/cjs/react-dom-client.development.js:18758:19
      at runWithFiberInDEV (node_modules/react-dom/cjs/react-dom-client.development.js:874:13)
      at warnIfUpdatesNotWrappedWithActDEV (node_modules/react-dom/cjs/react-dom-client.development.js:18757:9)
      at scheduleUpdateOnFiber (node_modules/react-dom/cjs/react-dom-client.development.js:16409:11)
      at dispatchSetStateInternal (node_modules/react-dom/cjs/react-dom-client.development.js:9170:13)
      at dispatchSetState (node_modules/react-dom/cjs/react-dom-client.development.js:9127:7)
      at src/components/FileUpload/FileUpload.tsx:199:9
      at Object.<anonymous> (tests/components/FileUpload.test.tsx:15:10)

  ● FileUpload › simulates upload progress

    expect(received).toBeInTheDocument()

    received value must be an HTMLElement or an SVGElement.
    Received has value: null

      194 |     // eslint-disable-next-line testing-library/no-container, testing-library/no-node-access
      195 |     const successIcon = container.querySelector('.text-success-500');
    > 196 |     expect(successIcon).toBeInTheDocument();
          |                         ^
      197 |   });
      198 | });
      199 |

      at __EXTERNAL_MATCHER_TRAP__ (node_modules/expect/build/index.js:2240:22)
      at Object.throwingMatcher [as toBeInTheDocument] (node_modules/expect/build/index.js:2241:6)
      at Object.<anonymous> (tests/components/FileUpload.test.tsx:196:25)

PASS tests/components/Accordion.test.tsx
PASS tests/components/CheckboxGroup.test.tsx
PASS tests/components/Tooltip.test.tsx
PASS tests/components/MultiSelect.test.tsx
PASS tests/components/RadioGroup.test.tsx
PASS tests/components/Alert.test.tsx
PASS tests/components/Radio.test.tsx
PASS tests/components/Input.test.tsx
PASS tests/components/SideMenu.test.tsx
PASS tests/components/Checkbox.test.tsx
  ● Console

    console.error
      You provided a `checked` prop to a form field without an `onChange` handler. This will render a read-only field. If the field should be mutable use `defaultChecked`. Otherwise, set either `onChange` or `readOnly`.

      12 |   );
      13 |
    > 14 |   return render(ui, { wrapper: Wrapper, ...options });
         |                ^
      15 | };
      16 |
      17 | // Re-export everything

      at checkControlledValueProps (node_modules/react-dom/cjs/react-dom-client.development.js:1432:17)
      at setInitialProperties (node_modules/react-dom/cjs/react-dom-client.development.js:20534:11)
      at completeWork (node_modules/react-dom/cjs/react-dom-client.development.js:12662:18)
      at runWithFiberInDEV (node_modules/react-dom/cjs/react-dom-client.development.js:874:13)
      at completeUnitOfWork (node_modules/react-dom/cjs/react-dom-client.development.js:17777:19)
      at performUnitOfWork (node_modules/react-dom/cjs/react-dom-client.development.js:17658:11)
      at workLoopSync (node_modules/react-dom/cjs/react-dom-client.development.js:17469:41)
      at renderRootSync (node_modules/react-dom/cjs/react-dom-client.development.js:17450:11)
      at performWorkOnRoot (node_modules/react-dom/cjs/react-dom-client.development.js:16504:11)
      at performWorkOnRootViaSchedulerTask (node_modules/react-dom/cjs/react-dom-client.development.js:18957:7)
      at flushActQueue (node_modules/react/cjs/react.development.js:590:34)
      at process.env.NODE_ENV.exports.act (node_modules/react/cjs/react.development.js:884:10)
      at node_modules/@testing-library/react/dist/act-compat.js:47:25
      at renderRoot (node_modules/@testing-library/react/dist/pure.js:190:26)
      at render (node_modules/@testing-library/react/dist/pure.js:292:10)
      at customRender (tests/test-utils.tsx:14:16)
      at Object.<anonymous> (tests/components/Checkbox.test.tsx:49:13)

PASS tests/components/Modal.test.tsx
PASS tests/components/Toast.test.tsx
PASS tests/components/Button.test.tsx
PASS tests/components/Menu.test.tsx
PASS tests/components/Card.test.tsx
  ● Console

    console.log
      HTML: <div><div class="vtx-card vtx-card--elevated vtx-card--md"><div class="vtx-card-content">Test content</div></div></div>

      at Object.<anonymous> (tests/components/Card.test.tsx:15:15)

    console.log
      FirstChild: <ref *1> HTMLDivElement {
        '__reactFiber$bcgzcmm3aek': <ref *2> FiberNode {
          tag: 5,
          key: null,
          elementType: 'div',
          type: 'div',
          stateNode: [Circular *1],
          return: FiberNode {
            tag: 10,
            key: null,
            elementType: [Object],
            type: [Object],
            stateNode: null,
            return: [FiberNode],
            child: [Circular *2],
            sibling: null,
            index: 0,
            ref: null,
            refCleanup: null,
            pendingProps: [Object],
            memoizedProps: [Object],
            updateQueue: null,
            memoizedState: null,
            dependencies: null,
            mode: 3,
            flags: 0,
            subtreeFlags: 9963521,
            deletions: null,
            lanes: 0,
            childLanes: 0,
            alternate: null,
            actualDuration: 1.165262000000439,
            actualStartTime: 296.15938000000006,
            selfBaseDuration: 0.01867800000036368,
            treeBaseDuration: 0.3361720000011701,
            _debugInfo: null,
            _debugOwner: [FiberNode],
            _debugStack: Error: react-stack-top-frame
                at process.env.NODE_ENV.exports.jsx (/app/node_modules/react/cjs/react-jsx-runtime.development.js:333:13)
                at ToastProvider (/app/src/components/Toast/useToast.tsx:96:10)
                at Object.react_stack_bottom_frame (/app/node_modules/react-dom/cjs/react-dom-client.development.js:25904:20)
                at renderWithHooks (/app/node_modules/react-dom/cjs/react-dom-client.development.js:7662:22)
                at updateFunctionComponent (/app/node_modules/react-dom/cjs/react-dom-client.development.js:10166:19)
                at beginWork (/app/node_modules/react-dom/cjs/react-dom-client.development.js:11778:18)
                at runWithFiberInDEV (/app/node_modules/react-dom/cjs/react-dom-client.development.js:874:13)
                at performUnitOfWork (/app/node_modules/react-dom/cjs/react-dom-client.development.js:17641:22)
                at workLoopSync (/app/node_modules/react-dom/cjs/react-dom-client.development.js:17469:41)
                at renderRootSync (/app/node_modules/react-dom/cjs/react-dom-client.development.js:17450:11)
                at performWorkOnRoot (/app/node_modules/react-dom/cjs/react-dom-client.development.js:16504:11)
                at performWorkOnRootViaSchedulerTask (/app/node_modules/react-dom/cjs/react-dom-client.development.js:18957:7)
                at flushActQueue (/app/node_modules/react/cjs/react.development.js:590:34)
                at process.env.NODE_ENV.exports.act (/app/node_modules/react/cjs/react.development.js:884:10)
                at /app/node_modules/@testing-library/react/dist/act-compat.js:47:25
                at renderRoot (/app/node_modules/@testing-library/react/dist/pure.js:190:26)
                at render (/app/node_modules/@testing-library/react/dist/pure.js:292:10)
                at customRender (/app/tests/test-utils.tsx:14:16)
                at Object.<anonymous> (/app/tests/components/Card.test.tsx:14:35)
                at Promise.finally.completed (/app/node_modules/jest-circus/build/jestAdapterInit.js:1557:28)
                at new Promise (<anonymous>)
                at callAsyncCircusFn (/app/node_modules/jest-circus/build/jestAdapterInit.js:1497:10)
                at _callCircusTest (/app/node_modules/jest-circus/build/jestAdapterInit.js:1007:40)
                at processTicksAndRejections (node:internal/process/task_queues:105:5)
                at _runTest (/app/node_modules/jest-circus/build/jestAdapterInit.js:947:3)
                at /app/node_modules/jest-circus/build/jestAdapterInit.js:849:7
                at _runTestsForDescribeBlock (/app/node_modules/jest-circus/build/jestAdapterInit.js:862:11)
                at _runTestsForDescribeBlock (/app/node_modules/jest-circus/build/jestAdapterInit.js:857:11)
                at _runTestsForDescribeBlock (/app/node_modules/jest-circus/build/jestAdapterInit.js:857:11)
                at run (/app/node_modules/jest-circus/build/jestAdapterInit.js:761:3)
                at runAndTransformResultsToJestFormat (/app/node_modules/jest-circus/build/jestAdapterInit.js:1918:21)
                at jestAdapter (/app/node_modules/jest-circus/build/runner.js:101:19)
                at runTestInternal (/app/node_modules/jest-runner/build/testWorker.js:275:16)
                at runTest (/app/node_modules/jest-runner/build/testWorker.js:343:7)
                at Object.worker (/app/node_modules/jest-runner/build/testWorker.js:497:12),
            _debugTask: null,
            _debugNeedsRemount: false,
            _debugHookTypes: null
          },
          child: FiberNode {
            tag: 11,
            key: null,
            elementType: [Object],
            type: [Object],
            stateNode: null,
            return: [Circular *2],
            child: [FiberNode],
            sibling: null,
            index: 0,
            ref: null,
            refCleanup: null,
            pendingProps: [Object],
            memoizedProps: [Object],
            updateQueue: null,
            memoizedState: null,
            dependencies: [Object],
            mode: 3,
            flags: 524289,
            subtreeFlags: 1048576,
            deletions: null,
            lanes: 0,
            childLanes: 0,
            alternate: null,
            actualDuration: 0.9424579999995331,
            actualStartTime: 296.1881620000004,
            selfBaseDuration: 0.23893799999950716,
            treeBaseDuration: 0.2532890000002226,
            _debugInfo: null,
            _debugOwner: null,
            _debugStack: Error: react-stack-top-frame
                at process.env.NODE_ENV.exports.jsx (/app/node_modules/react/cjs/react-jsx-runtime.development.js:333:13)
                at Object.<anonymous> (/app/tests/components/Card.test.tsx:14:36)
                at Promise.finally.completed (/app/node_modules/jest-circus/build/jestAdapterInit.js:1557:28)
                at new Promise (<anonymous>)
                at callAsyncCircusFn (/app/node_modules/jest-circus/build/jestAdapterInit.js:1497:10)
                at _callCircusTest (/app/node_modules/jest-circus/build/jestAdapterInit.js:1007:40)
                at processTicksAndRejections (node:internal/process/task_queues:105:5)
                at _runTest (/app/node_modules/jest-circus/build/jestAdapterInit.js:947:3)
                at /app/node_modules/jest-circus/build/jestAdapterInit.js:849:7
                at _runTestsForDescribeBlock (/app/node_modules/jest-circus/build/jestAdapterInit.js:862:11)
                at _runTestsForDescribeBlock (/app/node_modules/jest-circus/build/jestAdapterInit.js:857:11)
                at _runTestsForDescribeBlock (/app/node_modules/jest-circus/build/jestAdapterInit.js:857:11)
                at run (/app/node_modules/jest-circus/build/jestAdapterInit.js:761:3)
                at runAndTransformResultsToJestFormat (/app/node_modules/jest-circus/build/jestAdapterInit.js:1918:21)
                at jestAdapter (/app/node_modules/jest-circus/build/runner.js:101:19)
                at runTestInternal (/app/node_modules/jest-runner/build/testWorker.js:275:16)
                at runTest (/app/node_modules/jest-runner/build/testWorker.js:343:7)
                at Object.worker (/app/node_modules/jest-runner/build/testWorker.js:497:12),
            _debugTask: null,
            _debugNeedsRemount: false,
            _debugHookTypes: [Array]
          },
          sibling: FiberNode {
            tag: 0,
            key: null,
            elementType: [Function: ToastContainerInner],
            type: [Function: ToastContainerInner],
            stateNode: null,
            return: [FiberNode],
            child: null,
            sibling: null,
            index: 1,
            ref: null,
            refCleanup: null,
            pendingProps: [Object],
            memoizedProps: [Object],
            updateQueue: [Object],
            memoizedState: [Object],
            dependencies: [Object],
            mode: 3,
            flags: 9963521,
            subtreeFlags: 0,
            deletions: null,
            lanes: 0,
            childLanes: 0,
            alternate: null,
            actualDuration: 0.05667100000027858,
            actualStartTime: 297.2941430000001,
            selfBaseDuration: 0.055503000000499014,
            treeBaseDuration: 0.055503000000499014,
            _debugInfo: null,
            _debugOwner: [FiberNode],
            _debugStack: Error: react-stack-top-frame
                at process.env.NODE_ENV.exports.jsx (/app/node_modules/react/cjs/react-jsx-runtime.development.js:333:13)
                at ToastContainer (/app/src/components/Toast/ToastContainer.tsx:149:7)
                at Object.react_stack_bottom_frame (/app/node_modules/react-dom/cjs/react-dom-client.development.js:25904:20)
                at renderWithHooks (/app/node_modules/react-dom/cjs/react-dom-client.development.js:7662:22)
                at updateFunctionComponent (/app/node_modules/react-dom/cjs/react-dom-client.development.js:10166:19)
                at beginWork (/app/node_modules/react-dom/cjs/react-dom-client.development.js:11778:18)
                at runWithFiberInDEV (/app/node_modules/react-dom/cjs/react-dom-client.development.js:874:13)
                at performUnitOfWork (/app/node_modules/react-dom/cjs/react-dom-client.development.js:17641:22)
                at workLoopSync (/app/node_modules/react-dom/cjs/react-dom-client.development.js:17469:41)
                at renderRootSync (/app/node_modules/react-dom/cjs/react-dom-client.development.js:17450:11)
                at performWorkOnRoot (/app/node_modules/react-dom/cjs/react-dom-client.development.js:16504:11)
                at performWorkOnRootViaSchedulerTask (/app/node_modules/react-dom/cjs/react-dom-client.development.js:18957:7)
                at flushActQueue (/app/node_modules/react/cjs/react.development.js:590:34)
                at process.env.NODE_ENV.exports.act (/app/node_modules/react/cjs/react.development.js:884:10)
                at /app/node_modules/@testing-library/react/dist/act-compat.js:47:25
                at renderRoot (/app/node_modules/@testing-library/react/dist/pure.js:190:26)
                at render (/app/node_modules/@testing-library/react/dist/pure.js:292:10)
                at customRender (/app/tests/test-utils.tsx:14:16)
                at Object.<anonymous> (/app/tests/components/Card.test.tsx:14:35)
                at Promise.finally.completed (/app/node_modules/jest-circus/build/jestAdapterInit.js:1557:28)
                at new Promise (<anonymous>)
                at callAsyncCircusFn (/app/node_modules/jest-circus/build/jestAdapterInit.js:1497:10)
                at _callCircusTest (/app/node_modules/jest-circus/build/jestAdapterInit.js:1007:40)
                at processTicksAndRejections (node:internal/process/task_queues:105:5)
                at _runTest (/app/node_modules/jest-circus/build/jestAdapterInit.js:947:3)
                at /app/node_modules/jest-circus/build/jestAdapterInit.js:849:7
                at _runTestsForDescribeBlock (/app/node_modules/jest-circus/build/jestAdapterInit.js:862:11)
                at _runTestsForDescribeBlock (/app/node_modules/jest-circus/build/jestAdapterInit.js:857:11)
                at _runTestsForDescribeBlock (/app/node_modules/jest-circus/build/jestAdapterInit.js:857:11)
                at run (/app/node_modules/jest-circus/build/jestAdapterInit.js:761:3)
                at runAndTransformResultsToJestFormat (/app/node_modules/jest-circus/build/jestAdapterInit.js:1918:21)
                at jestAdapter (/app/node_modules/jest-circus/build/runner.js:101:19)
                at runTestInternal (/app/node_modules/jest-runner/build/testWorker.js:275:16)
                at runTest (/app/node_modules/jest-runner/build/testWorker.js:343:7)
                at Object.worker (/app/node_modules/jest-runner/build/testWorker.js:497:12),
            _debugTask: null,
            _debugNeedsRemount: false,
            _debugHookTypes: [Array]
          },
          index: 0,
          ref: null,
          refCleanup: null,
          pendingProps: { ref: null, children: [Object] },
          memoizedProps: { ref: null, children: [Object] },
          updateQueue: null,
          memoizedState: null,
          dependencies: null,
          mode: 3,
          flags: 1048576,
          subtreeFlags: 1572865,
          deletions: null,
          lanes: 0,
          childLanes: 0,
          alternate: null,
          actualDuration: 1.0791679999992994,
          actualStartTime: 296.1788889999998,
          selfBaseDuration: 0.008702000000084809,
          treeBaseDuration: 0.2619910000003074,
          _debugInfo: null,
          _debugOwner: FiberNode {
            tag: 11,
            key: null,
            elementType: [Object],
            type: [Object],
            stateNode: null,
            return: [FiberNode],
            child: [FiberNode],
            sibling: null,
            index: 0,
            ref: null,
            refCleanup: null,
            pendingProps: [Object],
            memoizedProps: [Object],
            updateQueue: [Object],
            memoizedState: [Object],
            dependencies: null,
            mode: 3,
            flags: 8390657,
            subtreeFlags: 9963521,
            deletions: null,
            lanes: 0,
            childLanes: 0,
            alternate: null,
            actualDuration: 1.770833000001403,
            actualStartTime: 295.55417000000034,
            selfBaseDuration: 0.38159900000027847,
            treeBaseDuration: 0.9302410000027521,
            _debugInfo: null,
            _debugOwner: [FiberNode],
            _debugStack: Error: react-stack-top-frame
                at process.env.NODE_ENV.exports.jsx (/app/node_modules/react/cjs/react-jsx-runtime.development.js:333:13)
                at Wrapper (/app/tests/test-utils.tsx:11:5)
                at Object.react_stack_bottom_frame (/app/node_modules/react-dom/cjs/react-dom-client.development.js:25904:20)
                at renderWithHooks (/app/node_modules/react-dom/cjs/react-dom-client.development.js:7662:22)
                at updateFunctionComponent (/app/node_modules/react-dom/cjs/react-dom-client.development.js:10166:19)
                at beginWork (/app/node_modules/react-dom/cjs/react-dom-client.development.js:11778:18)
                at runWithFiberInDEV (/app/node_modules/react-dom/cjs/react-dom-client.development.js:874:13)
                at performUnitOfWork (/app/node_modules/react-dom/cjs/react-dom-client.development.js:17641:22)
                at workLoopSync (/app/node_modules/react-dom/cjs/react-dom-client.development.js:17469:41)
                at renderRootSync (/app/node_modules/react-dom/cjs/react-dom-client.development.js:17450:11)
                at performWorkOnRoot (/app/node_modules/react-dom/cjs/react-dom-client.development.js:16504:11)
                at performWorkOnRootViaSchedulerTask (/app/node_modules/react-dom/cjs/react-dom-client.development.js:18957:7)
                at flushActQueue (/app/node_modules/react/cjs/react.development.js:590:34)
                at process.env.NODE_ENV.exports.act (/app/node_modules/react/cjs/react.development.js:884:10)
                at /app/node_modules/@testing-library/react/dist/act-compat.js:47:25
                at renderRoot (/app/node_modules/@testing-library/react/dist/pure.js:190:26)
                at render (/app/node_modules/@testing-library/react/dist/pure.js:292:10)
                at customRender (/app/tests/test-utils.tsx:14:16)
                at Object.<anonymous> (/app/tests/components/Card.test.tsx:14:35)
                at Promise.finally.completed (/app/node_modules/jest-circus/build/jestAdapterInit.js:1557:28)
                at new Promise (<anonymous>)
                at callAsyncCircusFn (/app/node_modules/jest-circus/build/jestAdapterInit.js:1497:10)
                at _callCircusTest (/app/node_modules/jest-circus/build/jestAdapterInit.js:1007:40)
                at processTicksAndRejections (node:internal/process/task_queues:105:5)
                at _runTest (/app/node_modules/jest-circus/build/jestAdapterInit.js:947:3)
                at /app/node_modules/jest-circus/build/jestAdapterInit.js:849:7
                at _runTestsForDescribeBlock (/app/node_modules/jest-circus/build/jestAdapterInit.js:862:11)
                at _runTestsForDescribeBlock (/app/node_modules/jest-circus/build/jestAdapterInit.js:857:11)
                at _runTestsForDescribeBlock (/app/node_modules/jest-circus/build/jestAdapterInit.js:857:11)
                at run (/app/node_modules/jest-circus/build/jestAdapterInit.js:761:3)
                at runAndTransformResultsToJestFormat (/app/node_modules/jest-circus/build/jestAdapterInit.js:1918:21)
                at jestAdapter (/app/node_modules/jest-circus/build/runner.js:101:19)
                at runTestInternal (/app/node_modules/jest-runner/build/testWorker.js:275:16)
                at runTest (/app/node_modules/jest-runner/build/testWorker.js:343:7)
                at Object.worker (/app/node_modules/jest-runner/build/testWorker.js:497:12),
            _debugTask: null,
            _debugNeedsRemount: false,
            _debugHookTypes: [Array]
          },
          _debugStack: Error: react-stack-top-frame
              at process.env.NODE_ENV.exports.jsx (/app/node_modules/react/cjs/react-jsx-runtime.development.js:333:13)
              at ThemeProvider (/app/src/theme/ThemeProvider.tsx:149:11)
              at Object.react_stack_bottom_frame (/app/node_modules/react-dom/cjs/react-dom-client.development.js:25904:20)
              at renderWithHooks (/app/node_modules/react-dom/cjs/react-dom-client.development.js:7662:22)
              at updateForwardRef (/app/node_modules/react-dom/cjs/react-dom-client.development.js:9724:19)
              at beginWork (/app/node_modules/react-dom/cjs/react-dom-client.development.js:12117:18)
              at runWithFiberInDEV (/app/node_modules/react-dom/cjs/react-dom-client.development.js:874:13)
              at performUnitOfWork (/app/node_modules/react-dom/cjs/react-dom-client.development.js:17641:22)
              at workLoopSync (/app/node_modules/react-dom/cjs/react-dom-client.development.js:17469:41)
              at renderRootSync (/app/node_modules/react-dom/cjs/react-dom-client.development.js:17450:11)
              at performWorkOnRoot (/app/node_modules/react-dom/cjs/react-dom-client.development.js:16504:11)
              at performWorkOnRootViaSchedulerTask (/app/node_modules/react-dom/cjs/react-dom-client.development.js:18957:7)
              at flushActQueue (/app/node_modules/react/cjs/react.development.js:590:34)
              at process.env.NODE_ENV.exports.act (/app/node_modules/react/cjs/react.development.js:884:10)
              at /app/node_modules/@testing-library/react/dist/act-compat.js:47:25
              at renderRoot (/app/node_modules/@testing-library/react/dist/pure.js:190:26)
              at render (/app/node_modules/@testing-library/react/dist/pure.js:292:10)
              at customRender (/app/tests/test-utils.tsx:14:16)
              at Object.<anonymous> (/app/tests/components/Card.test.tsx:14:35)
              at Promise.finally.completed (/app/node_modules/jest-circus/build/jestAdapterInit.js:1557:28)
              at new Promise (<anonymous>)
              at callAsyncCircusFn (/app/node_modules/jest-circus/build/jestAdapterInit.js:1497:10)
              at _callCircusTest (/app/node_modules/jest-circus/build/jestAdapterInit.js:1007:40)
              at processTicksAndRejections (node:internal/process/task_queues:105:5)
              at _runTest (/app/node_modules/jest-circus/build/jestAdapterInit.js:947:3)
              at /app/node_modules/jest-circus/build/jestAdapterInit.js:849:7
              at _runTestsForDescribeBlock (/app/node_modules/jest-circus/build/jestAdapterInit.js:862:11)
              at _runTestsForDescribeBlock (/app/node_modules/jest-circus/build/jestAdapterInit.js:857:11)
              at _runTestsForDescribeBlock (/app/node_modules/jest-circus/build/jestAdapterInit.js:857:11)
              at run (/app/node_modules/jest-circus/build/jestAdapterInit.js:761:3)
              at runAndTransformResultsToJestFormat (/app/node_modules/jest-circus/build/jestAdapterInit.js:1918:21)
              at jestAdapter (/app/node_modules/jest-circus/build/runner.js:101:19)
              at runTestInternal (/app/node_modules/jest-runner/build/testWorker.js:275:16)
              at runTest (/app/node_modules/jest-runner/build/testWorker.js:343:7)
              at Object.worker (/app/node_modules/jest-runner/build/testWorker.js:497:12),
          _debugTask: null,
          _debugNeedsRemount: false,
          _debugHookTypes: null
        },
        '__reactProps$bcgzcmm3aek': {
          ref: null,
          children: {
            '$$typeof': Symbol(react.transitional.element),
            type: [Object],
            key: null,
            props: [Object],
            _owner: null,
            _store: {}
          }
        }
      }

      at Object.<anonymous> (tests/components/Card.test.tsx:16:15)

    console.log
      FirstChild className:

      at Object.<anonymous> (tests/components/Card.test.tsx:17:15)

    console.log
      FirstChild tagName: DIV

      at Object.<anonymous> (tests/components/Card.test.tsx:18:15)

PASS tests/components/Select.test.tsx
PASS tests/widgets/OrderDetails.test.tsx
PASS tests/components/Chip.test.tsx
PASS tests/components/Grid.test.tsx
PASS tests/components/Table.test.tsx
PASS tests/components/DataGrid.test.tsx
PASS tests/components/Divider.test.tsx
PASS tests/theme/ThemeProvider.test.tsx
PASS tests/components/Flex.test.tsx
PASS tests/widgets/OrderConfirmation.test.tsx
PASS tests/components/Badge.test.tsx
PASS tests/widgets/ProductCard.test.tsx
PASS tests/hooks/index.test.tsx
PASS tests/components/Avatar.test.tsx
PASS tests/hooks/useTheme.test.tsx
PASS tests/components/Box.test.tsx

Summary of all failing tests
FAIL tests/components/Text.test.tsx
  ● Text › applies color styles

    expect(received).toBe(expected) // Object.is equality

    Expected: "rgb(255, 0, 0)"
    Received: ""

      47 |     render(<Text color="#ff0000">Red text</Text>);
      48 |     const element = screen.getByText('Red text');
    > 49 |     expect(element.style.color).toBe('rgb(255, 0, 0)');
         |                                 ^
      50 |   });
      51 |
      52 |   it('applies weight classes', () => {

      at Object.<anonymous> (tests/components/Text.test.tsx:49:33)

FAIL tests/components/FileUpload.test.tsx
  ● FileUpload › simulates upload progress

    expect(received).toBeInTheDocument()

    received value must be an HTMLElement or an SVGElement.
    Received has value: null

      194 |     // eslint-disable-next-line testing-library/no-container, testing-library/no-node-access
      195 |     const successIcon = container.querySelector('.text-success-500');
    > 196 |     expect(successIcon).toBeInTheDocument();
          |                         ^
      197 |   });
      198 | });
      199 |

      at __EXTERNAL_MATCHER_TRAP__ (node_modules/expect/build/index.js:2240:22)
      at Object.throwingMatcher [as toBeInTheDocument] (node_modules/expect/build/index.js:2241:6)
      at Object.<anonymous> (tests/components/FileUpload.test.tsx:196:25)


Test Suites: 2 failed, 31 passed, 33 total
Tests:       2 failed, 650 passed, 652 total
Snapshots:   0 total
Time:        10.581 s
Ran all test suites.
